{
  "schema_version": "1",
  "manifest_id": "g37-performance-scenarios-v1",
  "ledger": {
    "document": "docs/architecture/hot-path-complexity.md",
    "registry_heading": "Implemented row identities",
    "implemented_heading": "Implemented bounds",
    "expected_rows": 54
  },
  "probe_protocol": "g37.performance-probe.v1",
  "scenarios": [
    {
      "scenario_id": "g37-s01-modality-streaming",
      "driver": "modality_streaming",
      "scales": [64, 256, 1024],
      "repetitions": 5,
      "resource_bounds": {"maximum_elapsed_ms": 60000, "maximum_peak_rss_mib": 1024, "maximum_output_bytes": 1048576},
      "implementation_refs": ["crates/medulla-modality/src/served.rs::ServedModalityRuntime"],
      "rows": [
        {"row_id": "G37-HP-001", "equivalence_checks": ["stream_matches_sequential", "rollback_restores_snapshot"], "thresholds": {"maximum_work_units": 10000000, "maximum_work_growth_ratio": 24, "maximum_peak_memory_bytes": 1073741824, "maximum_memory_growth_ratio": 32, "maximum_latency_p99_ms": 30000, "maximum_latency_growth_ratio": 50}},
        {"row_id": "G37-HP-002", "equivalence_checks": ["cursor_page_matches_reference"], "thresholds": {"maximum_work_units": 1000000, "maximum_work_growth_ratio": 8, "maximum_peak_memory_bytes": 1073741824, "maximum_memory_growth_ratio": 16, "maximum_latency_p99_ms": 30000, "maximum_latency_growth_ratio": 30}},
        {"row_id": "G37-HP-003", "equivalence_checks": ["cdc_suffix_matches_reference"], "thresholds": {"maximum_work_units": 1000000, "maximum_work_growth_ratio": 3, "maximum_peak_memory_bytes": 1073741824, "maximum_memory_growth_ratio": 8, "maximum_latency_p99_ms": 30000, "maximum_latency_growth_ratio": 20}},
        {"row_id": "G37-HP-004", "equivalence_checks": ["snapshot_roundtrip", "idempotency_outcomes_preserved"], "thresholds": {"maximum_work_units": 10000000, "maximum_work_growth_ratio": 24, "maximum_peak_memory_bytes": 1073741824, "maximum_memory_growth_ratio": 24, "maximum_latency_p99_ms": 30000, "maximum_latency_growth_ratio": 50}},
        {"row_id": "G37-HP-005", "equivalence_checks": ["active_count_matches_scan"], "thresholds": {"maximum_work_units": 16, "maximum_work_growth_ratio": 2, "maximum_peak_memory_bytes": 1073741824, "maximum_memory_growth_ratio": 4, "maximum_latency_p99_ms": 30000, "maximum_latency_growth_ratio": 10}}
      ]
    },
    {
      "scenario_id": "g37-s02-analytics-restart-claim",
      "driver": "analytics_restart_claim",
      "scales": [64, 256, 1024],
      "repetitions": 5,
      "resource_bounds": {"maximum_elapsed_ms": 120000, "maximum_peak_rss_mib": 1024, "maximum_output_bytes": 1048576},
      "implementation_refs": ["crates/medulla-jobs/src/store.rs::JobStore"],
      "rows": [
        {"row_id": "G37-HP-006", "equivalence_checks": ["restart_next_id_monotonic", "scheduler_index_marker_valid"], "thresholds": {"maximum_work_units": 64, "maximum_work_growth_ratio": 3, "maximum_peak_memory_bytes": 1073741824, "maximum_memory_growth_ratio": 8, "maximum_latency_p99_ms": 30000, "maximum_latency_growth_ratio": 15}},
        {"row_id": "G37-HP-007", "equivalence_checks": ["repeated_claim_same_fence", "worker_index_matches_job"], "thresholds": {"maximum_work_units": 128, "maximum_work_growth_ratio": 8, "maximum_peak_memory_bytes": 1073741824, "maximum_memory_growth_ratio": 8, "maximum_latency_p99_ms": 30000, "maximum_latency_growth_ratio": 20}}
      ]
    },
    {
      "scenario_id": "g37-s03-tms-retirement",
      "driver": "tms_retirement",
      "scales": [64, 256, 1024],
      "repetitions": 5,
      "resource_bounds": {"maximum_elapsed_ms": 60000, "maximum_peak_rss_mib": 1024, "maximum_output_bytes": 1048576},
      "implementation_refs": ["crates/medulla-epistemic/src/recompute.rs::TruthMaintenance"],
      "rows": [
        {"row_id": "G37-HP-008", "equivalence_checks": ["retired_generator_changes_exact_closure", "unrelated_materializations_unchanged"], "thresholds": {"maximum_work_units": 1000000, "maximum_work_growth_ratio": 8, "maximum_peak_memory_bytes": 1073741824, "maximum_memory_growth_ratio": 12, "maximum_latency_p99_ms": 30000, "maximum_latency_growth_ratio": 25}}
      ]
    },
    {
      "scenario_id": "g37-s04-generated-by-reconciliation",
      "driver": "generated_by_reconciliation",
      "scales": [64, 256, 1024],
      "repetitions": 5,
      "resource_bounds": {"maximum_elapsed_ms": 60000, "maximum_peak_rss_mib": 1024, "maximum_output_bytes": 1048576},
      "implementation_refs": ["crates/medulla-epistemic/src/incremental.rs::IncrementalReasoningIndex"],
      "rows": [
        {"row_id": "G37-HP-009", "equivalence_checks": ["canonical_target_order_independent", "mixed_provenance_ignored"], "thresholds": {"maximum_work_units": 1000000, "maximum_work_growth_ratio": 8, "maximum_peak_memory_bytes": 1073741824, "maximum_memory_growth_ratio": 12, "maximum_latency_p99_ms": 30000, "maximum_latency_growth_ratio": 25}}
      ]
    },
    {
      "scenario_id": "g37-s05-scheduler-placement-quota",
      "driver": "scheduler_placement_quota",
      "scales": [64, 256, 1024],
      "repetitions": 5,
      "resource_bounds": {"maximum_elapsed_ms": 120000, "maximum_peak_rss_mib": 1024, "maximum_output_bytes": 1048576},
      "implementation_refs": ["crates/medulla-jobs/src/store.rs::JobStore"],
      "rows": [
        {"row_id": "G37-HP-010", "equivalence_checks": ["selected_job_matches_full_reference", "unsatisfied_anchors_not_decoded"], "thresholds": {"maximum_work_units": 10000000, "maximum_work_growth_ratio": 24, "maximum_peak_memory_bytes": 1073741824, "maximum_memory_growth_ratio": 24, "maximum_latency_p99_ms": 30000, "maximum_latency_growth_ratio": 50}},
        {"row_id": "G37-HP-011", "equivalence_checks": ["tenant_counters_match_active_jobs"], "thresholds": {"maximum_work_units": 256, "maximum_work_growth_ratio": 8, "maximum_peak_memory_bytes": 1073741824, "maximum_memory_growth_ratio": 8, "maximum_latency_p99_ms": 30000, "maximum_latency_growth_ratio": 20}},
        {"row_id": "G37-HP-036", "equivalence_checks": ["placement_match_equivalent", "candidate_loop_allocation_free"], "thresholds": {"maximum_work_units": 1000000, "maximum_work_growth_ratio": 20, "maximum_peak_memory_bytes": 1073741824, "maximum_memory_growth_ratio": 8, "maximum_latency_p99_ms": 30000, "maximum_latency_growth_ratio": 30}}
      ]
    },
    {
      "scenario_id": "g37-s06-result-cache",
      "driver": "result_cache",
      "scales": [64, 256, 1024],
      "repetitions": 7,
      "resource_bounds": {"maximum_elapsed_ms": 60000, "maximum_peak_rss_mib": 1024, "maximum_output_bytes": 1048576},
      "implementation_refs": ["crates/medulla-core/src/result_cache.rs::ResultCache"],
      "rows": [
        {"row_id": "G37-HP-012", "equivalence_checks": ["lru_victim_matches_reference", "capacity_never_exceeded"], "thresholds": {"maximum_work_units": 256, "maximum_work_growth_ratio": 8, "maximum_peak_memory_bytes": 1073741824, "maximum_memory_growth_ratio": 20, "maximum_latency_p99_ms": 30000, "maximum_latency_growth_ratio": 25}},
        {"row_id": "G37-HP-013", "equivalence_checks": ["hit_payload_exact", "payload_copy_outside_lock"], "thresholds": {"maximum_work_units": 256, "maximum_work_growth_ratio": 8, "maximum_peak_memory_bytes": 1073741824, "maximum_memory_growth_ratio": 20, "maximum_latency_p99_ms": 30000, "maximum_latency_growth_ratio": 25}}
      ]
    },
    {
      "scenario_id": "g37-s07-promql-predecessor",
      "driver": "promql_predecessor",
      "scales": [64, 256, 1024],
      "repetitions": 7,
      "resource_bounds": {"maximum_elapsed_ms": 60000, "maximum_peak_rss_mib": 1024, "maximum_output_bytes": 1048576},
      "implementation_refs": ["crates/medulla-tsdb/src/promql.rs::Evaluator"],
      "rows": [
        {"row_id": "G37-HP-014", "equivalence_checks": ["tail_matches_binary_search_reference", "defensive_wide_slice_matches"], "thresholds": {"maximum_work_units": 128, "maximum_work_growth_ratio": 8, "maximum_peak_memory_bytes": 1073741824, "maximum_memory_growth_ratio": 8, "maximum_latency_p99_ms": 30000, "maximum_latency_growth_ratio": 20}}
      ]
    },
    {
      "scenario_id": "g37-s08-edge-cardinality-delete",
      "driver": "edge_cardinality_delete",
      "scales": [64, 256, 1024],
      "repetitions": 5,
      "resource_bounds": {"maximum_elapsed_ms": 60000, "maximum_peak_rss_mib": 1024, "maximum_output_bytes": 1048576},
      "implementation_refs": ["crates/medulla-core/src/graph.rs::GraphCore"],
      "rows": [
        {"row_id": "G37-HP-015", "equivalence_checks": ["edge_count_matches_enumeration", "parallel_edges_counted"], "thresholds": {"maximum_work_units": 16, "maximum_work_growth_ratio": 2, "maximum_peak_memory_bytes": 1073741824, "maximum_memory_growth_ratio": 4, "maximum_latency_p99_ms": 30000, "maximum_latency_growth_ratio": 10}},
        {"row_id": "G37-HP-016", "equivalence_checks": ["logical_delete_matches_reference", "unrelated_edges_preserved"], "thresholds": {"maximum_work_units": 100000, "maximum_work_growth_ratio": 8, "maximum_peak_memory_bytes": 1073741824, "maximum_memory_growth_ratio": 12, "maximum_latency_p99_ms": 30000, "maximum_latency_growth_ratio": 25}},
        {"row_id": "G37-HP-017", "equivalence_checks": ["resident_evict_matches_reference", "logical_rows_preserved"], "thresholds": {"maximum_work_units": 1000000, "maximum_work_growth_ratio": 20, "maximum_peak_memory_bytes": 1073741824, "maximum_memory_growth_ratio": 20, "maximum_latency_p99_ms": 30000, "maximum_latency_growth_ratio": 35}}
      ]
    },
    {
      "scenario_id": "g37-s09-parallel-edge-removal",
      "driver": "parallel_edge_removal",
      "scales": [1, 100, 10000],
      "repetitions": 5,
      "resource_bounds": {"maximum_elapsed_ms": 60000, "maximum_peak_rss_mib": 1024, "maximum_output_bytes": 1048576},
      "implementation_refs": ["crates/medulla-core/src/graph.rs::GraphTxn"],
      "rows": [